<?xml version="1.0" encoding="UTF-8" standalone="no"?><OldCards xmlns:xsi="http://www.w3.org/2001/XMLSchema-instance" xsi:noNamespaceSchemaLocation="input-no-targetNamespace.xsd"><OldCard><Thema>CitySightseeing</Thema><Type>Greeting</Type><Country>France</Country><Year>1970</Year><Author>James Been</Author><Valuable>Thematical</Valuable></OldCard><OldCard><Thema>Nature</Thema><Type>Advertisement</Type><Country>Great Britain</Country><Year>1995</Year><Valuable>Historical</Valuable></OldCard></OldCards>